<?xml version="1.0" encoding="UTF-8"?>
<!--
 CDDL HEADER START

 The contents of this file are subject to the terms of the
 Common Development and Distribution License, Version 1.0 only
 (the "License"). You may not use this file except in compliance
 with the License.

 You can obtain a copy of the license at license/ESCIDOC.LICENSE
 or http://www.escidoc.org/license.
 See the License for the specific language governing permissions
 and limitations under the License.

 When distributing Covered Code, include this CDDL HEADER in each
 file and include the License file at license/ESCIDOC.LICENSE.
 If applicable, add the following below this CDDL HEADER, with the
 fields enclosed by brackets "[]" replaced with your own identifying
 information: Portions Copyright [yyyy] [name of copyright owner]

 CDDL HEADER END


 Copyright 2006-2012 Fachinformationszentrum Karlsruhe Gesellschaft
 für wissenschaftlich-technische Information mbH and Max-Planck-
 Gesellschaft zur Förderung der Wissenschaft e.V.
 All rights reserved. Use is subject to license terms.
-->
<models xmlns:xsi="http://www.w3.org/2001/XMLSchema-instance" xsi:noNamespaceSchemaLocation="models.xsd">
	<model>
		<name>journals</name>
		<aliases>
			<alias>jnar</alias>
			<alias>journals</alias>
		</aliases>
		<description>Journal Names</description>
		<open>true</open>
		<primary-identifier control="false" subject-prefix="journals/resource/" generate-cone-id="false"></primary-identifier>
		<predicates>
			<predicate name="Journal Name" value="http://purl.org/dc/elements/1.1/title" multiple="false" mandatory="true" localized="false" searchable="true" shouldBeUnique="true"/>
			<predicate name="Alternative Journal Name" value="http://purl.org/dc/terms/alternative" multiple="true" mandatory="false" localized="false" searchable="true" shouldBeUnique="true"/>
			<predicate name="Abbreviation" value="http://purl.org/escidoc/metadata/terms/0.1/abbreviation" multiple="false" mandatory="false" localized="false" searchable="true" shouldBeUnique="true"/>
			<predicate name="Identifier" value="http://purl.org/dc/elements/1.1/identifier" multiple="true" mandatory="false" localized="false" generateObject="true" searchable="true">
				<predicate name="Value" value="http://www.w3.org/1999/02/22-rdf-syntax-ns#value" multiple="false" mandatory="true" localized="false" searchable="true" shouldBeUnique="true"/>
				<predicate name="ID Type" value="http://www.w3.org/2001/XMLSchema-instance type" multiple="false" mandatory="true" localized="false" searchable="false"/>
			</predicate>
			<predicate name="Publisher" value="http://purl.org/dc/elements/1.1/publisher" multiple="false" mandatory="false" localized="false" searchable="true"/>
			<predicate name="Publisher Place" value="http://purl.org/dc/terms/publisher" multiple="false" mandatory="false" localized="true" searchable="true"/>
			<predicate name="Citation Style" value="http://purl.org/escidoc/metadata/terms/0.1/citation-style" multiple="false" mandatory="false" localized="false" searchable="true"/>
		</predicates>
		<results>
			<result>
				<type>main</type>
				<result-pattern>
&lt;http://purl.org/dc/elements/1.1/title&gt;
OR{&lt;http://purl.org/dc/elements/1.1/publisher&gt;,&lt;http://purl.org/dc/terms/publisher&gt;}:;
&lt;http://purl.org/dc/elements/1.1/publisher&gt;
AND{&lt;http://purl.org/dc/elements/1.1/publisher&gt;,&lt;http://purl.org/dc/terms/publisher&gt;}:,
&lt;http://purl.org/dc/terms/publisher&gt;
				</result-pattern>
				<sort-pattern>
&lt;http://purl.org/dc/elements/1.1/title&gt;
OR{&lt;http://purl.org/dc/elements/1.1/publisher&gt;,&lt;http://purl.org/dc/terms/publisher&gt;}:;
&lt;http://purl.org/dc/elements/1.1/publisher&gt;
AND{&lt;http://purl.org/dc/elements/1.1/publisher&gt;,&lt;http://purl.org/dc/terms/publisher&gt;}:,
&lt;http://purl.org/dc/terms/publisher&gt;
				</sort-pattern>
			</result>
			<result>
				<type>alt</type>
				<result-pattern>
&lt;http://purl.org/escidoc/metadata/terms/0.1/abbreviation&gt;
AND{&lt;http://purl.org/escidoc/metadata/terms/0.1/abbreviation&gt;,OR{&lt;http://purl.org/dc/elements/1.1/publisher&gt;,&lt;http://purl.org/dc/terms/publisher&gt;}}:;
&lt;http://purl.org/escidoc/metadata/terms/0.1/abbreviation&gt;:&lt;http://purl.org/dc/elements/1.1/publisher&gt;
AND{&lt;http://purl.org/escidoc/metadata/terms/0.1/abbreviation&gt;,&lt;http://purl.org/dc/elements/1.1/publisher&gt;,&lt;http://purl.org/dc/terms/publisher&gt;}:,
&lt;http://purl.org/escidoc/metadata/terms/0.1/abbreviation&gt;:&lt;http://purl.org/dc/terms/publisher&gt;
				</result-pattern>
				<sort-pattern>
&lt;http://purl.org/dc/elements/1.1/title&gt;
OR{&lt;http://purl.org/dc/elements/1.1/publisher&gt;,&lt;http://purl.org/dc/terms/publisher&gt;}:;
&lt;http://purl.org/dc/elements/1.1/publisher&gt;
AND{&lt;http://purl.org/dc/elements/1.1/publisher&gt;,&lt;http://purl.org/dc/terms/publisher&gt;}:,
&lt;http://purl.org/dc/terms/publisher&gt;
 &lt;http://purl.org/escidoc/metadata/terms/0.1/abbreviation&gt;
 				</sort-pattern>
			</result>
			<result>
				<type>alt</type>
				<result-pattern>
&lt;http://purl.org/dc/terms/alternative&gt;
AND{&lt;http://purl.org/dc/terms/alternative&gt;,OR{&lt;http://purl.org/dc/elements/1.1/publisher&gt;,&lt;http://purl.org/dc/terms/publisher&gt;}}:;
&lt;http://purl.org/dc/terms/alternative&gt;:&lt;http://purl.org/dc/elements/1.1/publisher&gt;
AND{&lt;http://purl.org/dc/terms/alternative&gt;,&lt;http://purl.org/dc/elements/1.1/publisher&gt;,&lt;http://purl.org/dc/terms/publisher&gt;}:,
&lt;http://purl.org/dc/terms/alternative&gt;:&lt;http://purl.org/dc/terms/publisher&gt;
				</result-pattern>
				<sort-pattern>
&lt;http://purl.org/dc/elements/1.1/title&gt;
OR{&lt;http://purl.org/dc/elements/1.1/publisher&gt;,&lt;http://purl.org/dc/terms/publisher&gt;}:;
&lt;http://purl.org/dc/elements/1.1/publisher&gt;
AND{&lt;http://purl.org/dc/elements/1.1/publisher&gt;,&lt;http://purl.org/dc/terms/publisher&gt;}:,
&lt;http://purl.org/dc/terms/publisher&gt;
 &lt;http://purl.org/dc/terms/alternative&gt;
 				</sort-pattern>
			</result>
		</results>
	</model>

	<model>
		<name>iso639-1</name>
		<aliases>
			<alias>iso639-1</alias>
		</aliases>
		<description>Languages</description>
		<open>false</open>
		<primary-identifier control="true" subject-prefix="iso639-1/resource/" generate-cone-id="false">http://purl.org/dc/elements/1.1/identifier</primary-identifier>
		<predicates>
			<predicate name="ISO639-3 Relation" value="http://purl.org/dc/elements/1.1/relation" multiple="false" mandatory="true" localized="false" searchable="true" generateObject="false" resourceModel="iso639-3" shouldBeUnique="true"/>
			<predicate name="ISO639 Code" value="http://purl.org/dc/elements/1.1/identifier" multiple="false" mandatory="true" localized="false" searchable="true" shouldBeUnique="true"/>
		</predicates>
		<results>
			<result>
				<result-pattern>
&lt;http://purl.org/dc/elements/1.1/identifier&gt;
 -
&lt;http://purl.org/dc/elements/1.1/relation|http://purl.org/dc/elements/1.1/title&gt;
					</result-pattern>

			</result>
		</results>
	</model>

	<model>
		<name>iso639-2</name>
		<aliases>
			<alias>iso639-2</alias>
		</aliases>
		<description>Languages</description>
		<open>false</open>
		<primary-identifier control="true" subject-prefix="iso639-2/resource/" generate-cone-id="false">http://purl.org/dc/elements/1.1/identifier</primary-identifier>
		<predicates>
			<predicate name="ISO639-3 Relation" value="http://purl.org/dc/elements/1.1/relation" multiple="false" mandatory="false" localized="false" searchable="true" generateObject="false" resourceModel="iso639-3" shouldBeUnique="true"/>
			<predicate name="ISO639 Code" value="http://purl.org/dc/elements/1.1/identifier" multiple="false" mandatory="true" localized="false" searchable="true" shouldBeUnique="true"/>
			<predicate name="Name" value="http://purl.org/dc/elements/1.1/title" multiple="false" mandatory="false" localized="true" searchable="true" shouldBeUnique="true"/>
		</predicates>
		<results>
			<result>
				<result-pattern>
&lt;http://purl.org/dc/elements/1.1/identifier&gt;
AND{&lt;http://purl.org/dc/elements/1.1/identifier&gt;,&lt;http://purl.org/dc/elements/1.1/relation|http://purl.org/dc/elements/1.1/identifier&gt;}: /
&lt;http://purl.org/dc/elements/1.1/relation|http://purl.org/dc/elements/1.1/identifier&gt;
 -
&lt;http://purl.org/dc/elements/1.1/title&gt;
NOT{&lt;http://purl.org/dc/elements/1.1/title&gt;}:&lt;http://purl.org/dc/elements/1.1/relation|http://purl.org/dc/elements/1.1/title&gt;
					</result-pattern>

			</result>
		</results>
	</model>

	<model>
		<name>iso639-3</name>
		<aliases>
			<alias>iso639-3</alias>
		</aliases>
		<description>Languages</description>
		<open>false</open>
		<primary-identifier control="true" subject-prefix="iso639-3/resource/" generate-cone-id="false">http://purl.org/dc/elements/1.1/identifier</primary-identifier>
		<predicates>
			<predicate name="Name" value="http://purl.org/dc/elements/1.1/title" multiple="false" mandatory="true" localized="true" searchable="true" shouldBeUnique="true"/>
			<predicate name="ISO639 Code" value="http://purl.org/dc/elements/1.1/identifier" multiple="false" mandatory="true" localized="false" searchable="true" shouldBeUnique="true"/>
			<predicate name="Geo location" value="http://earth.google.com/kml/2.1 coordinates" multiple="false" localized="false" searchable="true" mandatory="false"/>
		</predicates>
		<results>
			<result>
				<result-pattern>
&lt;http://purl.org/dc/elements/1.1/identifier&gt;
 -
&lt;http://purl.org/dc/elements/1.1/title&gt;
				</result-pattern>
			</result>
		</results>
	</model>

	<model>
		<name>persons</name>
		<aliases>
			<alias>authors</alias>
			<alias>persons</alias>
		</aliases>
		<description>Persons</description>
		<open>true</open>
		<primary-identifier control="false" generate-cone-id="true"/>
		<predicates>